"Occupation Title","Occupation Code","Occupation Type","2022 Employment","2022 Percent of Industry","2022 Percent of Occupation","Projected 2032 Employment","Projected 2032 Percent of Industry","Projected 2032 Percent of Occupation","Employment Change, 2022-2032","Employment Percent Change, 2022-2032","Occupation Sort","Display Level"
"Total, all occupations","=""00-0000""","Summary","40.9","100.0","0.0","32.6","100.0","0.0","-8.2","-20.1","","0"
"Management occupations","=""11-0000""","Summary","2.5","6.1","0.0","2.1","6.4","0.0","-0.4","-17.2","2","1"
"Top executives","=""11-1000""","Summary","1.0","2.6","0.0","0.9","2.6","0.0","-0.2","-18.0","3","2"
"Chief executives","=""11-1011""","Line Item","0.1","0.1","0.0","0.0","0.1","0.0","0.0","-29.8","4","3"
"General and operations managers","=""11-1021""","Line Item","1.0","2.4","0.0","0.8","2.5","0.0","-0.2","-17.4","5","3"
"Advertising, marketing, promotions, public relations, and sales managers","=""11-2000""","Summary","0.3","0.7","0.0","0.2","0.7","0.0","0.0","-17.4","7","2"
"Marketing and sales managers","=""11-2020""","Summary","0.2","0.6","0.0","0.2","0.6","0.0","0.0","-17.4","9","3"
"Marketing managers","=""11-2021""","Line Item","0.1","0.3","0.0","0.1","0.3","0.0","0.0","-17.4","10","4"
"Sales managers","=""11-2022""","Line Item","0.1","0.3","0.0","0.1","0.4","0.0","0.0","-17.4","11","4"
"Operations specialties managers","=""11-3000""","Summary","0.9","2.1","0.0","0.7","2.2","0.0","-0.1","-16.1","15","2"
"Administrative services and facilities managers","=""11-3010""","Summary","0.1","0.2","0.0","0.1","0.2","0.0","0.0","-17.4","16","3"
"Administrative services managers","=""11-3012""","Line Item","0.1","0.2","0.0","0.1","0.2","0.0","0.0","-17.4","17","4"
"Computer and information systems managers","=""11-3021""","Line Item","0.1","0.2","0.0","0.1","0.2","0.0","0.0","-11.6","19","3"
"Financial managers","=""11-3031""","Line Item","0.1","0.2","0.0","0.1","0.2","0.0","0.0","-9.2","20","3"
"Industrial production managers","=""11-3051""","Line Item","0.4","1.0","0.2","0.3","1.1","0.2","-0.1","-17.4","21","3"
"Purchasing managers","=""11-3061""","Line Item","0.1","0.1","0.1","0.0","0.1","0.1","0.0","-17.4","22","3"
"Transportation, storage, and distribution managers","=""11-3071""","Line Item","0.1","0.2","0.0","0.1","0.2","0.0","0.0","-17.4","23","3"
"Human resources managers","=""11-3121""","Line Item","0.1","0.1","0.0","0.0","0.1","0.0","0.0","-17.4","25","3"
"Other management occupations","=""11-9000""","Summary","0.3","0.8","0.0","0.3","0.8","0.0","-0.1","-17.4","27","2"
"Architectural and engineering managers","=""11-9041""","Line Item","0.2","0.5","0.1","0.2","0.5","0.1","0.0","-17.4","35","3"
"Managers, all other","=""11-9199""","Line Item","0.1","0.3","0.0","0.1","0.3","0.0","0.0","-17.4","50","3"
"Business and financial operations occupations","=""13-0000""","Summary","1.9","4.6","0.0","1.5","4.6","0.0","-0.3","-18.8","51","1"
"Business operations specialists","=""13-1000""","Summary","1.6","3.9","0.0","1.3","3.9","0.0","-0.3","-19.0","52","2"
"Buyers and purchasing agents","=""13-1020""","Line Item","0.6","1.4","0.1","0.4","1.3","0.1","-0.2","-25.7","54","3"
"Compliance officers","=""13-1041""","Line Item","0.1","0.2","0.0","0.1","0.3","0.0","0.0","-17.4","58","3"
"Human resources workers","=""13-1070""","Summary","0.2","0.5","0.0","0.2","0.5","0.0","0.0","-19.1","60","3"
"Human resources specialists","=""13-1071""","Line Item","0.2","0.5","0.0","0.2","0.5","0.0","0.0","-19.1","61","4"
"Logisticians and project management specialists","=""13-1080""","Summary","0.3","0.7","0.0","0.2","0.8","0.0","0.0","-10.5","64","3"
"Logisticians","=""13-1081""","Line Item","0.2","0.5","0.1","0.2","0.5","0.1","0.0","-7.5","65","4"
"Project management specialists","=""13-1082""","Line Item","0.1","0.2","0.0","0.1","0.2","0.0","0.0","-17.4","66","4"
"Training and development specialists","=""13-1151""","Line Item","0.1","0.3","0.0","0.1","0.3","0.0","0.0","-17.4","71","3"
"Market research analysts and marketing specialists","=""13-1161""","Line Item","0.2","0.4","0.0","0.1","0.4","0.0","0.0","-11.6","72","3"
"Business operations specialists, all other","=""13-1199""","Line Item","0.1","0.3","0.0","0.1","0.3","0.0","0.0","-17.4","73","3"
"Financial specialists","=""13-2000""","Summary","0.3","0.7","0.0","0.2","0.7","0.0","0.0","-17.4","74","2"
"Accountants and auditors","=""13-2011""","Line Item","0.2","0.6","0.0","0.2","0.6","0.0","0.0","-17.4","75","3"
"Computer and mathematical occupations","=""15-0000""","Summary","0.5","1.2","0.0","0.4","1.3","0.0","-0.1","-14.4","92","1"
"Computer occupations","=""15-1200""","Summary","0.5","1.2","0.0","0.4","1.2","0.0","-0.1","-14.7","93","2"
"Computer and information analysts","=""15-1210""","Summary","0.1","0.2","0.0","0.1","0.2","0.0","0.0","-14.9","94","3"
"Computer systems analysts","=""15-1211""","Line Item","0.1","0.1","0.0","0.0","0.1","0.0","0.0","-17.4","95","4"
"Computer support specialists","=""15-1230""","Summary","0.1","0.3","0.0","0.1","0.3","0.0","0.0","-20.3","98","3"
"Computer user support specialists","=""15-1232""","Line Item","0.1","0.2","0.0","0.1","0.2","0.0","0.0","-20.7","100","4"
"Software developers","=""15-1252""","Line Item","0.1","0.3","0.0","0.1","0.3","0.0","0.0","-5.0","108","4"
"Computer occupations, all other","=""15-1299""","Line Item","0.1","0.2","0.0","0.1","0.2","0.0","0.0","-17.4","112","3"
"Architecture and engineering occupations","=""17-0000""","Summary","2.8","6.8","0.1","2.4","7.4","0.1","-0.4","-13.8","120","1"
"Engineers","=""17-2000""","Summary","2.1","5.1","0.1","1.8","5.6","0.1","-0.2","-12.0","128","2"
"Electrical and electronics engineers","=""17-2070""","Summary","0.2","0.5","0.1","0.2","0.5","0.0","0.0","-17.4","135","3"
"Electrical engineers","=""17-2071""","Line Item","0.2","0.4","0.1","0.1","0.4","0.1","0.0","-17.4","136","4"
"Industrial engineers, including health and safety","=""17-2110""","Summary","0.8","1.8","0.2","0.7","2.1","0.2","-0.1","-10.1","139","3"
"Industrial engineers","=""17-2112""","Line Item","0.7","1.8","0.2","0.7","2.0","0.2","-0.1","-10.0","141","4"
"Mechanical engineers","=""17-2141""","Line Item","0.9","2.1","0.3","0.8","2.4","0.2","-0.1","-10.8","144","3"
"Engineers, all other","=""17-2199""","Line Item","0.2","0.4","0.1","0.1","0.5","0.1","0.0","-17.4","148","3"
"Drafters, engineering technicians, and mapping technicians","=""17-3000""","Summary","0.7","1.8","0.1","0.6","1.8","0.1","-0.1","-18.9","149","2"
"Drafters","=""17-3010""","Summary","0.1","0.2","0.0","0.1","0.2","0.0","0.0","-25.7","150","3"
"Mechanical drafters","=""17-3013""","Line Item","0.1","0.2","0.2","0.1","0.2","0.1","0.0","-25.7","153","4"
"Engineering technologists and technicians, except drafters","=""17-3020""","Summary","0.6","1.6","0.2","0.5","1.6","0.1","-0.1","-18.0","155","3"
"Electrical and electronic engineering technologists and technicians","=""17-3023""","Line Item","0.2","0.5","0.2","0.2","0.5","0.2","0.0","-17.4","158","4"
"Industrial engineering technologists and technicians","=""17-3026""","Line Item","0.2","0.5","0.3","0.2","0.5","0.2","0.0","-17.4","161","4"
"Mechanical engineering technologists and technicians","=""17-3027""","Line Item","0.1","0.2","0.2","0.1","0.2","0.1","0.0","-21.5","162","4"
"Engineering technologists and technicians, except drafters, all other","=""17-3029""","Line Item","0.1","0.2","0.1","0.1","0.3","0.1","0.0","-17.4","164","4"
"Life, physical, and social science occupations","=""19-0000""","Summary","0.1","0.2","0.0","0.1","0.2","0.0","0.0","-12.9","166","1"
"Arts, design, entertainment, sports, and media occupations","=""27-0000""","Summary","0.3","0.7","0.0","0.2","0.7","0.0","0.0","-17.4","355","1"
"Art and design workers","=""27-1000""","Summary","0.2","0.6","0.0","0.2","0.6","0.0","0.0","-17.4","356","2"
"Designers","=""27-1020""","Summary","0.2","0.6","0.0","0.2","0.6","0.0","0.0","-17.4","363","3"
"Commercial and industrial designers","=""27-1021""","Line Item","0.1","0.3","0.4","0.1","0.3","0.3","0.0","-17.4","364","4"
"Graphic designers","=""27-1024""","Line Item","0.1","0.3","0.0","0.1","0.3","0.0","0.0","-17.4","367","4"
"Building and grounds cleaning and maintenance occupations","=""37-0000""","Summary","0.1","0.3","0.0","0.1","0.3","0.0","0.0","-18.2","581","1"
"Building cleaning and pest control workers","=""37-2000""","Summary","0.1","0.3","0.0","0.1","0.3","0.0","0.0","-18.2","585","2"
"Building cleaning workers","=""37-2010""","Summary","0.1","0.3","0.0","0.1","0.3","0.0","0.0","-18.2","586","3"
"Janitors and cleaners, except maids and housekeeping cleaners","=""37-2011""","Line Item","0.1","0.3","0.0","0.1","0.3","0.0","0.0","-18.2","587","4"
"Sales and related occupations","=""41-0000""","Summary","0.9","2.3","0.0","0.8","2.4","0.0","-0.2","-17.4","644","1"
"Retail sales workers","=""41-2000""","Summary","0.1","0.1","0.0","0.1","0.2","0.0","0.0","-17.4","648","2"
"Retail salespersons","=""41-2031""","Line Item","0.1","0.1","0.0","0.0","0.1","0.0","0.0","-17.4","655","3"
"Sales representatives, wholesale and manufacturing","=""41-4000""","Summary","0.8","2.0","0.0","0.7","2.0","0.0","-0.1","-17.4","662","2"
"Sales representatives, wholesale and manufacturing, except technical and scientific products","=""41-4012""","Line Item","0.8","2.0","0.1","0.7","2.0","0.0","-0.1","-17.4","664","3"
"Office and administrative support occupations","=""43-0000""","Summary","3.4","8.3","0.0","2.5","7.8","0.0","-0.8","-24.9","677","1"
"Supervisors of office and administrative support workers","=""43-1000""","Summary","0.2","0.5","0.0","0.2","0.5","0.0","-0.1","-25.7","678","2"
"First-line supervisors of office and administrative support workers","=""43-1011""","Line Item","0.2","0.5","0.0","0.2","0.5","0.0","-0.1","-25.7","679","3"
"Financial clerks","=""43-3000""","Summary","0.5","1.3","0.0","0.4","1.2","0.0","-0.1","-25.9","684","2"
"Billing and posting clerks","=""43-3021""","Line Item","0.1","0.1","0.0","0.0","0.1","0.0","0.0","-25.7","686","3"
"Bookkeeping, accounting, and auditing clerks","=""43-3031""","Line Item","0.4","1.0","0.0","0.3","1.0","0.0","-0.1","-25.7","687","3"
"Information and record clerks","=""43-4000""","Summary","0.4","1.0","0.0","0.3","0.9","0.0","-0.1","-26.8","693","2"
"Customer service representatives","=""43-4051""","Line Item","0.3","0.8","0.0","0.2","0.7","0.0","-0.1","-25.7","698","3"
"Order clerks","=""43-4151""","Line Item","0.1","0.1","0.0","0.0","0.1","0.0","0.0","-33.9","706","3"
"Material recording, scheduling, dispatching, and distributing workers","=""43-5000""","Summary","1.5","3.7","0.1","1.2","3.6","0.0","-0.3","-22.1","711","2"
"Production, planning, and expediting clerks","=""43-5061""","Line Item","0.6","1.5","0.2","0.5","1.6","0.1","-0.1","-17.4","722","3"
"Shipping, receiving, and inventory clerks","=""43-5071""","Line Item","0.8","2.0","0.1","0.6","1.9","0.1","-0.2","-25.7","723","3"
"Secretaries and administrative assistants","=""43-6000""","Summary","0.3","0.7","0.0","0.2","0.6","0.0","-0.1","-31.5","725","2"
"Executive secretaries and executive administrative assistants","=""43-6011""","Line Item","0.1","0.2","0.0","0.0","0.1","0.0","0.0","-38.1","726","3"
"Secretaries and administrative assistants, except legal, medical, and executive","=""43-6014""","Line Item","0.2","0.6","0.0","0.2","0.5","0.0","-0.1","-29.8","729","3"
"Other office and administrative support workers","=""43-9000""","Summary","0.4","1.1","0.0","0.3","1.0","0.0","-0.1","-26.4","730","2"
"Office clerks, general","=""43-9061""","Line Item","0.4","0.9","0.0","0.3","0.9","0.0","-0.1","-25.7","737","3"
"Construction and extraction occupations","=""47-0000""","Summary","0.1","0.3","0.0","0.1","0.3","0.0","0.0","-17.4","763","1"
"Construction trades workers","=""47-2000""","Summary","0.1","0.3","0.0","0.1","0.3","0.0","0.0","-17.4","766","2"
"Installation, maintenance, and repair occupations","=""49-0000""","Summary","3.5","8.6","0.1","2.9","8.9","0.0","-0.6","-17.5","840","1"
"Supervisors of installation, maintenance, and repair workers","=""49-1000""","Summary","0.1","0.4","0.0","0.1","0.4","0.0","0.0","-17.4","841","2"
"First-line supervisors of mechanics, installers, and repairers","=""49-1011""","Line Item","0.1","0.4","0.0","0.1","0.4","0.0","0.0","-17.4","842","3"
"Vehicle and mobile equipment mechanics, installers, and repairers","=""49-3000""","Summary","1.4","3.5","0.1","1.2","3.6","0.1","-0.3","-17.7","857","2"
"Automotive technicians and repairers","=""49-3020""","Summary","0.1","0.2","0.0","0.1","0.2","0.0","0.0","-20.7","859","3"
"Automotive service technicians and mechanics","=""49-3023""","Line Item","0.1","0.2","0.0","0.1","0.2","0.0","0.0","-20.7","862","4"
"Bus and truck mechanics and diesel engine specialists","=""49-3031""","Line Item","0.1","0.2","0.0","0.1","0.2","0.0","0.0","-19.9","863","3"
"Heavy vehicle and mobile equipment service technicians and mechanics","=""49-3040""","Summary","1.1","2.7","0.5","0.9","2.8","0.4","-0.2","-17.4","864","3"
"Mobile heavy equipment mechanics, except engines","=""49-3042""","Line Item","1.1","2.7","0.7","0.9","2.8","0.5","-0.2","-17.4","866","4"
"Small engine mechanics","=""49-3050""","Summary","0.1","0.3","0.1","0.1","0.3","0.1","0.0","-17.4","868","3"
"Motorcycle mechanics","=""49-3052""","Line Item","0.1","0.2","0.5","0.1","0.2","0.4","0.0","-17.4","870","4"
"Miscellaneous vehicle and mobile equipment mechanics, installers, and repairers","=""49-3090""","Summary","0.1","0.2","0.0","0.1","0.2","0.0","0.0","-17.4","872","3"
"Bicycle repairers","=""49-3091""","Line Item","0.1","0.2","0.4","0.1","0.2","0.4","0.0","-17.4","873","4"
"Other installation, maintenance, and repair occupations","=""49-9000""","Summary","1.8","4.5","0.1","1.5","4.7","0.0","-0.3","-17.3","876","2"
"Industrial machinery installation, repair, and maintenance workers","=""49-9040""","Summary","0.6","1.5","0.1","0.5","1.6","0.1","-0.1","-17.1","882","3"
"Industrial machinery mechanics","=""49-9041""","Line Item","0.4","1.1","0.1","0.4","1.1","0.1","-0.1","-17.4","883","4"
"Maintenance workers, machinery","=""49-9043""","Line Item","0.2","0.4","0.3","0.1","0.4","0.2","0.0","-17.4","884","4"
"Maintenance and repair workers, general","=""49-9071""","Line Item","1.0","2.5","0.1","0.8","2.6","0.1","-0.2","-17.4","896","3"
"Miscellaneous installation, maintenance, and repair workers","=""49-9090""","Summary","0.2","0.5","0.1","0.2","0.5","0.0","0.0","-17.4","898","3"
"Installation, maintenance, and repair workers, all other","=""49-9099""","Line Item","0.2","0.4","0.1","0.2","0.5","0.1","0.0","-17.4","906","4"
"Production occupations","=""51-0000""","Summary","21.4","52.3","0.2","16.7","51.2","0.2","-4.7","-21.9","907","1"
"Supervisors of production workers","=""51-1000""","Summary","1.5","3.6","0.2","1.2","3.7","0.2","-0.3","-17.4","908","2"
"First-line supervisors of production and operating workers","=""51-1011""","Line Item","1.5","3.6","0.2","1.2","3.7","0.2","-0.3","-17.4","909","3"
"Assemblers and fabricators","=""51-2000""","Summary","8.6","21.2","0.4","6.4","19.7","0.4","-2.2","-25.6","910","2"
"Electrical, electronics, and electromechanical assemblers","=""51-2020""","Summary","0.2","0.4","0.1","0.1","0.4","0.0","0.0","-17.4","912","3"
"Electrical, electronic, and electromechanical assemblers, except coil winders, tapers, and finishers","=""51-2028""","Line Item","0.2","0.4","0.1","0.1","0.4","0.0","0.0","-17.4","914","4"
"Engine and other machine assemblers","=""51-2031""","Line Item","0.2","0.5","0.4","0.1","0.5","0.4","-0.1","-25.7","915","3"
"Structural metal fabricators and fitters","=""51-2041""","Line Item","0.2","0.5","0.4","0.1","0.4","0.3","-0.1","-33.9","916","3"
"Fiberglass laminators and fabricators","=""51-2051""","Line Item","0.1","0.3","0.6","0.1","0.4","0.5","0.0","-17.4","917","3"
"Miscellaneous assemblers and fabricators","=""51-2090""","Line Item","7.9","19.4","0.5","5.9","18.1","0.4","-2.0","-25.7","919","3"
"Metal workers and plastic workers","=""51-4000""","Summary","6.8","16.6","0.4","5.5","16.8","0.3","-1.3","-18.9","931","2"
"Forming machine setters, operators, and tenders, metal and plastic","=""51-4020""","Summary","0.1","0.3","0.1","0.1","0.2","0.1","0.0","-24.9","932","3"
"Rolling machine setters, operators, and tenders, metal and plastic","=""51-4023""","Line Item","0.1","0.2","0.3","0.1","0.2","0.2","0.0","-25.7","935","4"
"Machine tool cutting setters, operators, and tenders, metal and plastic","=""51-4030""","Summary","0.6","1.4","0.2","0.4","1.3","0.2","-0.2","-26.1","936","3"
"Cutting, punching, and press machine setters, operators, and tenders, metal and plastic","=""51-4031""","Line Item","0.4","0.9","0.2","0.3","0.8","0.2","-0.1","-25.7","937","4"
"Grinding, lapping, polishing, and buffing machine tool setters, operators, and tenders, metal and plastic","=""51-4033""","Line Item","0.2","0.4","0.2","0.1","0.4","0.2","0.0","-25.7","939","4"
"Machinists","=""51-4041""","Line Item","0.9","2.1","0.3","0.7","2.2","0.2","-0.2","-17.4","942","3"
"Molders and molding machine setters, operators, and tenders, metal and plastic","=""51-4070""","Summary","0.1","0.3","0.1","0.1","0.3","0.0","0.0","-21.5","949","3"
"Molding, coremaking, and casting machine setters, operators, and tenders, metal and plastic","=""51-4072""","Line Item","0.1","0.3","0.1","0.1","0.3","0.1","0.0","-21.5","951","4"
"Multiple machine tool setters, operators, and tenders, metal and plastic","=""51-4081""","Line Item","0.1","0.1","0.0","0.0","0.1","0.0","0.0","-17.4","952","3"
"Welding, soldering, and brazing workers","=""51-4120""","Summary","5.0","12.2","1.1","4.1","12.5","0.9","-0.9","-18.1","954","3"
"Welders, cutters, solderers, and brazers","=""51-4121""","Line Item","4.6","11.2","1.1","3.8","11.6","0.9","-0.8","-17.4","955","4"
"Welding, soldering, and brazing machine setters, operators, and tenders","=""51-4122""","Line Item","0.4","1.0","1.3","0.3","0.9","1.0","-0.1","-25.7","956","4"
"Textile, apparel, and furnishings workers","=""51-6000""","Summary","0.3","0.8","0.1","0.3","0.8","0.1","-0.1","-17.4","967","2"
"Sewing machine operators","=""51-6031""","Line Item","0.3","0.7","0.2","0.2","0.7","0.2","0.0","-17.4","970","3"
"Other production occupations","=""51-9000""","Summary","4.1","10.1","0.2","3.3","10.0","0.1","-0.9","-21.0","1009","2"
"Crushing, grinding, polishing, mixing, and blending workers","=""51-9020""","Summary","0.3","0.7","0.2","0.2","0.7","0.1","-0.1","-23.1","1013","3"
"Crushing, grinding, and polishing machine setters, operators, and tenders","=""51-9021""","Line Item","0.3","0.6","0.9","0.2","0.6","0.7","-0.1","-21.5","1014","4"
"Cutting workers","=""51-9030""","Summary","0.1","0.3","0.2","0.1","0.2","0.1","0.0","-38.1","1017","3"
"Cutters and trimmers, hand","=""51-9031""","Line Item","0.1","0.3","1.4","0.1","0.2","1.2","0.0","-38.1","1018","4"
"Inspectors, testers, sorters, samplers, and weighers","=""51-9061""","Line Item","0.9","2.2","0.2","0.7","2.1","0.1","-0.2","-25.7","1022","3"
"Painting workers","=""51-9120""","Summary","0.9","2.2","0.5","0.7","2.2","0.4","-0.2","-17.4","1029","3"
"Coating, painting, and spraying machine setters, operators, and tenders","=""51-9124""","Line Item","0.9","2.1","0.5","0.7","2.2","0.4","-0.2","-17.4","1031","4"
"Computer numerically controlled tool operators and programmers","=""51-9160""","Summary","0.5","1.1","0.2","0.4","1.1","0.2","-0.1","-22.5","1034","3"
"Computer numerically controlled tool operators","=""51-9161""","Line Item","0.4","0.9","0.2","0.3","0.9","0.2","-0.1","-25.7","1035","4"
"Computer numerically controlled tool programmers","=""51-9162""","Line Item","0.1","0.2","0.3","0.1","0.2","0.2","0.0","-6.7","1036","4"
"Miscellaneous production workers","=""51-9190""","Summary","1.4","3.3","0.2","1.1","3.4","0.2","-0.2","-18.1","1037","3"
"Helpers--production workers","=""51-9198""","Line Item","0.1","0.3","0.1","0.1","0.3","0.0","0.0","-25.7","1045","4"
"Production workers, all other","=""51-9199""","Line Item","1.2","3.0","0.5","1.0","3.1","0.4","-0.2","-17.4","1046","4"
"Transportation and material moving occupations","=""53-0000""","Summary","3.3","8.2","0.0","2.8","8.4","0.0","-0.6","-17.4","1047","1"
"Supervisors of transportation and material moving workers","=""53-1000""","Summary","0.1","0.3","0.0","0.1","0.3","0.0","0.0","-17.4","1048","2"
"First-line supervisors of transportation and material moving workers, except aircraft cargo handling supervisors","=""53-1047""","Line Item","0.1","0.3","0.0","0.1","0.3","0.0","0.0","-17.4","1050","3"
"Motor vehicle operators","=""53-3000""","Summary","0.4","1.0","0.0","0.3","1.0","0.0","-0.1","-17.4","1059","2"
"Driver/sales workers and truck drivers","=""53-3030""","Summary","0.4","1.0","0.0","0.3","1.0","0.0","-0.1","-17.4","1061","3"
"Heavy and tractor-trailer truck drivers","=""53-3032""","Line Item","0.3","0.6","0.0","0.2","0.7","0.0","0.0","-17.4","1063","4"
"Light truck drivers","=""53-3033""","Line Item","0.1","0.3","0.0","0.1","0.3","0.0","0.0","-17.4","1064","4"
"Material moving workers","=""53-7000""","Summary","2.8","6.9","0.0","2.3","7.2","0.0","-0.5","-17.4","1095","2"
"Industrial truck and tractor operators","=""53-7051""","Line Item","0.6","1.5","0.1","0.5","1.5","0.1","-0.1","-17.4","1100","3"
"Laborers and material movers","=""53-7060""","Summary","2.2","5.5","0.0","1.8","5.7","0.0","-0.4","-17.4","1101","3"
"Laborers and freight, stock, and material movers, hand","=""53-7062""","Line Item","1.8","4.3","0.1","1.5","4.5","0.0","-0.3","-17.4","1103","4"
"Packers and packagers, hand","=""53-7064""","Line Item","0.1","0.2","0.0","0.1","0.2","0.0","0.0","-17.4","1105","4"
"Stockers and order fillers","=""53-7065""","Line Item","0.3","0.8","0.0","0.3","0.9","0.0","-0.1","-17.4","1106","4"
