"Occupation Title","Occupation Code","Occupation Type","2022 Employment","2022 Percent of Industry","2022 Percent of Occupation","Projected 2032 Employment","Projected 2032 Percent of Industry","Projected 2032 Percent of Occupation","Employment Change, 2022-2032","Employment Percent Change, 2022-2032","Occupation Sort","Display Level"
"Total, all occupations","=""00-0000""","Summary","39.6","100.0","0.0","35.4","100.0","0.0","-4.2","-10.7","","0"
"Management occupations","=""11-0000""","Summary","4.2","10.7","0.0","3.9","11.0","0.0","-0.3","-8.1","2","1"
"Top executives","=""11-1000""","Summary","1.7","4.3","0.0","1.5","4.3","0.0","-0.2","-9.5","3","2"
"Chief executives","=""11-1011""","Line Item","0.1","0.3","0.0","0.1","0.3","0.0","0.0","-22.3","4","3"
"General and operations managers","=""11-1021""","Line Item","1.6","4.0","0.0","1.4","4.1","0.0","-0.1","-8.6","5","3"
"Advertising, marketing, promotions, public relations, and sales managers","=""11-2000""","Summary","0.8","2.1","0.1","0.7","2.1","0.1","-0.1","-8.6","7","2"
"Marketing and sales managers","=""11-2020""","Summary","0.8","2.0","0.1","0.7","2.0","0.1","-0.1","-8.6","9","3"
"Marketing managers","=""11-2021""","Line Item","0.2","0.6","0.1","0.2","0.6","0.1","0.0","-8.6","10","4"
"Sales managers","=""11-2022""","Line Item","0.5","1.4","0.1","0.5","1.4","0.1","0.0","-8.6","11","4"
"Operations specialties managers","=""11-3000""","Summary","1.3","3.4","0.1","1.3","3.5","0.0","-0.1","-6.0","15","2"
"Administrative services and facilities managers","=""11-3010""","Summary","0.1","0.3","0.0","0.1","0.3","0.0","0.0","-8.6","16","3"
"Administrative services managers","=""11-3012""","Line Item","0.1","0.2","0.0","0.1","0.2","0.0","0.0","-8.6","17","4"
"Computer and information systems managers","=""11-3021""","Line Item","0.1","0.3","0.0","0.1","0.3","0.0","0.0","-2.2","19","3"
"Financial managers","=""11-3031""","Line Item","0.3","0.7","0.0","0.3","0.8","0.0","0.0","0.6","20","3"
"Industrial production managers","=""11-3051""","Line Item","0.6","1.4","0.2","0.5","1.4","0.2","0.0","-8.6","21","3"
"Purchasing managers","=""11-3061""","Line Item","0.1","0.2","0.1","0.1","0.2","0.1","0.0","-8.6","22","3"
"Transportation, storage, and distribution managers","=""11-3071""","Line Item","0.1","0.4","0.1","0.1","0.4","0.1","0.0","-8.6","23","3"
"Other management occupations","=""11-9000""","Summary","0.4","1.0","0.0","0.4","1.0","0.0","0.0","-8.5","27","2"
"Architectural and engineering managers","=""11-9041""","Line Item","0.3","0.7","0.1","0.3","0.8","0.1","0.0","-8.6","35","3"
"Managers, all other","=""11-9199""","Line Item","0.1","0.2","0.0","0.1","0.3","0.0","0.0","-8.6","50","3"
"Business and financial operations occupations","=""13-0000""","Summary","2.8","7.2","0.0","2.6","7.3","0.0","-0.3","-9.3","51","1"
"Business operations specialists","=""13-1000""","Summary","2.2","5.5","0.0","2.0","5.6","0.0","-0.2","-9.4","52","2"
"Buyers and purchasing agents","=""13-1020""","Line Item","0.6","1.5","0.1","0.5","1.4","0.1","-0.1","-17.7","54","3"
"Cost estimators","=""13-1051""","Line Item","0.3","0.7","0.1","0.2","0.6","0.1","0.0","-13.1","59","3"
"Human resources workers","=""13-1070""","Summary","0.1","0.4","0.0","0.1","0.4","0.0","0.0","-10.4","60","3"
"Human resources specialists","=""13-1071""","Line Item","0.1","0.4","0.0","0.1","0.4","0.0","0.0","-10.4","61","4"
"Logisticians and project management specialists","=""13-1080""","Summary","0.4","1.1","0.0","0.4","1.2","0.0","0.0","-4.5","64","3"
"Logisticians","=""13-1081""","Line Item","0.2","0.4","0.1","0.2","0.5","0.1","0.0","2.4","65","4"
"Project management specialists","=""13-1082""","Line Item","0.3","0.7","0.0","0.3","0.7","0.0","0.0","-8.6","66","4"
"Management analysts","=""13-1111""","Line Item","0.1","0.2","0.0","0.1","0.2","0.0","0.0","-8.6","67","3"
"Market research analysts and marketing specialists","=""13-1161""","Line Item","0.5","1.2","0.1","0.5","1.4","0.0","0.0","-2.2","72","3"
"Business operations specialists, all other","=""13-1199""","Line Item","0.1","0.3","0.0","0.1","0.3","0.0","0.0","-8.6","73","3"
"Financial specialists","=""13-2000""","Summary","0.6","1.6","0.0","0.6","1.7","0.0","-0.1","-8.8","74","2"
"Accountants and auditors","=""13-2011""","Line Item","0.6","1.4","0.0","0.5","1.5","0.0","0.0","-8.6","75","3"
"Financial analysts and advisors","=""13-2050""","Summary","0.1","0.1","0.0","0.0","0.1","0.0","0.0","-8.6","79","3"
"Computer and mathematical occupations","=""15-0000""","Summary","0.9","2.2","0.0","0.8","2.3","0.0","0.0","-4.5","92","1"
"Computer occupations","=""15-1200""","Summary","0.8","2.1","0.0","0.8","2.3","0.0","0.0","-5.0","93","2"
"Computer and information analysts","=""15-1210""","Summary","0.1","0.2","0.0","0.1","0.2","0.0","0.0","1.7","94","3"
"Computer support specialists","=""15-1230""","Summary","0.2","0.4","0.0","0.1","0.4","0.0","0.0","-11.2","98","3"
"Computer user support specialists","=""15-1232""","Line Item","0.1","0.3","0.0","0.1","0.3","0.0","0.0","-12.2","100","4"
"Database and network administrators and architects","=""15-1240""","Summary","0.2","0.5","0.0","0.2","0.5","0.0","0.0","-13.0","101","3"
"Network and computer systems administrators","=""15-1244""","Line Item","0.1","0.3","0.0","0.1","0.3","0.0","0.0","-13.1","105","4"
"Software and web developers, programmers, and testers","=""15-1250""","Summary","0.3","0.8","0.0","0.3","0.9","0.0","0.0","3.3","106","3"
"Software developers","=""15-1252""","Line Item","0.2","0.6","0.0","0.2","0.7","0.0","0.0","5.2","108","4"
"Computer occupations, all other","=""15-1299""","Line Item","0.1","0.4","0.0","0.1","0.4","0.0","0.0","-8.6","112","3"
"Architecture and engineering occupations","=""17-0000""","Summary","2.6","6.7","0.1","2.9","8.2","0.1","0.2","9.1","120","1"
"Engineers","=""17-2000""","Summary","2.0","5.0","0.1","2.3","6.5","0.1","0.3","15.3","128","2"
"Electrical and electronics engineers","=""17-2070""","Summary","0.9","2.2","0.3","1.2","3.4","0.4","0.3","38.8","135","3"
"Electrical engineers","=""17-2071""","Line Item","0.8","2.0","0.4","1.1","3.2","0.6","0.3","41.7","136","4"
"Electronics engineers, except computer","=""17-2072""","Line Item","0.1","0.1","0.0","0.0","0.1","0.0","0.0","-8.6","137","4"
"Industrial engineers, including health and safety","=""17-2110""","Summary","0.5","1.4","0.2","0.5","1.5","0.1","0.0","-0.4","139","3"
"Industrial engineers","=""17-2112""","Line Item","0.5","1.4","0.2","0.5","1.5","0.1","0.0","-0.3","141","4"
"Mechanical engineers","=""17-2141""","Line Item","0.3","0.9","0.1","0.3","1.0","0.1","0.0","-1.2","144","3"
"Engineers, all other","=""17-2199""","Line Item","0.2","0.5","0.1","0.2","0.5","0.1","0.0","-8.6","148","3"
"Drafters, engineering technicians, and mapping technicians","=""17-3000""","Summary","0.6","1.6","0.1","0.6","1.6","0.1","-0.1","-10.1","149","2"
"Drafters","=""17-3010""","Summary","0.2","0.5","0.1","0.2","0.5","0.1","0.0","-11.7","150","3"
"Electrical and electronics drafters","=""17-3012""","Line Item","0.1","0.4","0.7","0.1","0.4","0.6","0.0","-8.6","152","4"
"Engineering technologists and technicians, except drafters","=""17-3020""","Summary","0.4","1.1","0.1","0.4","1.1","0.1","0.0","-9.3","155","3"
"Electrical and electronic engineering technologists and technicians","=""17-3023""","Line Item","0.3","0.7","0.3","0.3","0.7","0.3","0.0","-8.6","158","4"
"Mechanical engineering technologists and technicians","=""17-3027""","Line Item","0.1","0.2","0.1","0.1","0.1","0.1","0.0","-13.1","162","4"
"Life, physical, and social science occupations","=""19-0000""","Summary","0.1","0.1","0.0","0.1","0.1","0.0","0.0","-3.0","166","1"
"Arts, design, entertainment, sports, and media occupations","=""27-0000""","Summary","0.7","1.8","0.0","0.7","1.9","0.0","-0.1","-8.8","355","1"
"Art and design workers","=""27-1000""","Summary","0.6","1.4","0.1","0.5","1.5","0.1","0.0","-8.6","356","2"
"Artists and related workers","=""27-1010""","Summary","0.1","0.2","0.0","0.1","0.2","0.0","0.0","-8.6","357","3"
"Art directors","=""27-1011""","Line Item","0.1","0.1","0.0","0.1","0.1","0.0","0.0","-8.6","358","4"
"Designers","=""27-1020""","Summary","0.5","1.3","0.1","0.5","1.3","0.1","0.0","-8.6","363","3"
"Commercial and industrial designers","=""27-1021""","Line Item","0.2","0.6","0.7","0.2","0.6","0.6","0.0","-8.6","364","4"
"Graphic designers","=""27-1024""","Line Item","0.2","0.4","0.1","0.2","0.5","0.1","0.0","-8.6","367","4"
"Media and communication workers","=""27-3000""","Summary","0.1","0.2","0.0","0.1","0.2","0.0","0.0","-8.6","389","2"
"Media and communication equipment workers","=""27-4000""","Summary","0.1","0.2","0.0","0.1","0.2","0.0","0.0","-11.3","401","2"
"Building and grounds cleaning and maintenance occupations","=""37-0000""","Summary","0.1","0.3","0.0","0.1","0.3","0.0","0.0","-9.4","581","1"
"Building cleaning and pest control workers","=""37-2000""","Summary","0.1","0.3","0.0","0.1","0.3","0.0","0.0","-9.4","585","2"
"Building cleaning workers","=""37-2010""","Summary","0.1","0.3","0.0","0.1","0.3","0.0","0.0","-9.4","586","3"
"Janitors and cleaners, except maids and housekeeping cleaners","=""37-2011""","Line Item","0.1","0.3","0.0","0.1","0.3","0.0","0.0","-9.5","587","4"
"Sales and related occupations","=""41-0000""","Summary","2.0","5.2","0.0","1.9","5.3","0.0","-0.2","-8.6","644","1"
"Supervisors of sales workers","=""41-1000""","Summary","0.1","0.2","0.0","0.1","0.2","0.0","0.0","-8.6","645","2"
"First-line supervisors of non-retail sales workers","=""41-1012""","Line Item","0.1","0.2","0.0","0.1","0.2","0.0","0.0","-8.6","647","3"
"Sales representatives, wholesale and manufacturing","=""41-4000""","Summary","1.8","4.6","0.1","1.7","4.7","0.1","-0.2","-8.6","662","2"
"Sales representatives, wholesale and manufacturing, technical and scientific products","=""41-4011""","Line Item","0.1","0.3","0.0","0.1","0.3","0.0","0.0","-8.6","663","3"
"Sales representatives, wholesale and manufacturing, except technical and scientific products","=""41-4012""","Line Item","1.7","4.4","0.1","1.6","4.5","0.1","-0.1","-8.6","664","3"
"Other sales and related workers","=""41-9000""","Summary","0.1","0.2","0.0","0.1","0.2","0.0","0.0","-8.8","665","2"
"Office and administrative support occupations","=""43-0000""","Summary","5.4","13.6","0.0","4.4","12.5","0.0","-1.0","-18.1","677","1"
"Supervisors of office and administrative support workers","=""43-1000""","Summary","0.4","1.0","0.0","0.3","0.9","0.0","-0.1","-17.7","678","2"
"First-line supervisors of office and administrative support workers","=""43-1011""","Line Item","0.4","1.0","0.0","0.3","0.9","0.0","-0.1","-17.7","679","3"
"Financial clerks","=""43-3000""","Summary","1.0","2.4","0.0","0.8","2.2","0.0","-0.2","-17.8","684","2"
"Billing and posting clerks","=""43-3021""","Line Item","0.1","0.2","0.0","0.0","0.1","0.0","0.0","-17.7","686","3"
"Bookkeeping, accounting, and auditing clerks","=""43-3031""","Line Item","0.8","2.1","0.0","0.7","1.9","0.0","-0.1","-17.7","687","3"
"Procurement clerks","=""43-3061""","Line Item","0.1","0.1","0.1","0.0","0.1","0.1","0.0","-17.7","690","3"
"Information and record clerks","=""43-4000""","Summary","1.4","3.7","0.0","1.2","3.3","0.0","-0.3","-18.9","693","2"
"Customer service representatives","=""43-4051""","Line Item","1.2","2.9","0.0","1.0","2.7","0.0","-0.2","-17.7","698","3"
"Order clerks","=""43-4151""","Line Item","0.2","0.4","0.1","0.1","0.3","0.1","0.0","-26.8","706","3"
"Receptionists and information clerks","=""43-4171""","Line Item","0.1","0.2","0.0","0.1","0.2","0.0","0.0","-18.6","708","3"
"Material recording, scheduling, dispatching, and distributing workers","=""43-5000""","Summary","1.5","3.7","0.1","1.2","3.5","0.1","-0.2","-15.6","711","2"
"Production, planning, and expediting clerks","=""43-5061""","Line Item","0.3","0.9","0.1","0.3","0.9","0.1","0.0","-8.6","722","3"
"Shipping, receiving, and inventory clerks","=""43-5071""","Line Item","1.1","2.8","0.1","0.9","2.6","0.1","-0.2","-17.7","723","3"
"Secretaries and administrative assistants","=""43-6000""","Summary","0.4","1.1","0.0","0.3","0.9","0.0","-0.1","-24.0","725","2"
"Executive secretaries and executive administrative assistants","=""43-6011""","Line Item","0.1","0.2","0.0","0.1","0.1","0.0","0.0","-31.4","726","3"
"Secretaries and administrative assistants, except legal, medical, and executive","=""43-6014""","Line Item","0.3","0.9","0.0","0.3","0.8","0.0","-0.1","-22.3","729","3"
"Other office and administrative support workers","=""43-9000""","Summary","0.7","1.7","0.0","0.5","1.5","0.0","-0.1","-18.9","730","2"
"Office clerks, general","=""43-9061""","Line Item","0.6","1.4","0.0","0.5","1.3","0.0","-0.1","-17.7","737","3"
"Office and administrative support workers, all other","=""43-9199""","Line Item","0.1","0.2","0.0","0.1","0.1","0.0","0.0","-19.5","741","3"
"Construction and extraction occupations","=""47-0000""","Summary","0.3","0.8","0.0","0.3","0.8","0.0","0.0","-8.6","763","1"
"Construction trades workers","=""47-2000""","Summary","0.3","0.8","0.0","0.3","0.8","0.0","0.0","-8.6","766","2"
"Electricians","=""47-2111""","Line Item","0.3","0.8","0.0","0.3","0.8","0.0","0.0","-8.6","788","3"
"Installation, maintenance, and repair occupations","=""49-0000""","Summary","1.0","2.6","0.0","1.0","2.7","0.0","-0.1","-5.8","840","1"
"Supervisors of installation, maintenance, and repair workers","=""49-1000""","Summary","0.1","0.2","0.0","0.1","0.2","0.0","0.0","-8.6","841","2"
"First-line supervisors of mechanics, installers, and repairers","=""49-1011""","Line Item","0.1","0.2","0.0","0.1","0.2","0.0","0.0","-8.6","842","3"
"Other installation, maintenance, and repair occupations","=""49-9000""","Summary","0.9","2.4","0.0","0.9","2.5","0.0","-0.1","-5.4","876","2"
"Industrial machinery installation, repair, and maintenance workers","=""49-9040""","Summary","0.2","0.4","0.0","0.2","0.5","0.0","0.0","8.3","882","3"
"Industrial machinery mechanics","=""49-9041""","Line Item","0.1","0.4","0.0","0.2","0.5","0.0","0.0","9.7","883","4"
"Maintenance and repair workers, general","=""49-9071""","Line Item","0.3","0.7","0.0","0.2","0.7","0.0","0.0","-8.6","896","3"
"Miscellaneous installation, maintenance, and repair workers","=""49-9090""","Summary","0.5","1.2","0.1","0.4","1.2","0.1","0.0","-8.6","898","3"
"Installation, maintenance, and repair workers, all other","=""49-9099""","Line Item","0.4","1.1","0.2","0.4","1.1","0.2","0.0","-8.6","906","4"
"Production occupations","=""51-0000""","Summary","16.8","42.5","0.2","14.5","41.1","0.2","-2.3","-13.6","907","1"
"Supervisors of production workers","=""51-1000""","Summary","1.4","3.5","0.2","1.3","3.5","0.2","-0.1","-8.6","908","2"
"First-line supervisors of production and operating workers","=""51-1011""","Line Item","1.4","3.5","0.2","1.3","3.5","0.2","-0.1","-8.6","909","3"
"Assemblers and fabricators","=""51-2000""","Summary","10.4","26.2","0.5","8.8","24.9","0.5","-1.5","-14.9","910","2"
"Electrical, electronics, and electromechanical assemblers","=""51-2020""","Summary","5.8","14.6","2.0","5.3","14.9","1.7","-0.5","-9.0","912","3"
"Coil winders, tapers, and finishers","=""51-2021""","Line Item","0.2","0.4","1.4","0.1","0.3","1.2","0.0","-26.8","913","4"
"Electrical, electronic, and electromechanical assemblers, except coil winders, tapers, and finishers","=""51-2028""","Line Item","5.6","14.2","2.0","5.2","14.6","1.7","-0.5","-8.6","914","4"
"Miscellaneous assemblers and fabricators","=""51-2090""","Line Item","4.5","11.5","0.3","3.5","10.0","0.3","-1.0","-22.3","919","3"
"Metal workers and plastic workers","=""51-4000""","Summary","2.8","7.0","0.2","2.5","6.9","0.1","-0.3","-12.0","931","2"
"Forming machine setters, operators, and tenders, metal and plastic","=""51-4020""","Summary","0.4","0.9","0.4","0.3","0.9","0.3","-0.1","-15.2","932","3"
"Machine tool cutting setters, operators, and tenders, metal and plastic","=""51-4030""","Summary","0.6","1.6","0.2","0.5","1.4","0.2","-0.1","-17.7","936","3"
"Cutting, punching, and press machine setters, operators, and tenders, metal and plastic","=""51-4031""","Line Item","0.4","0.9","0.2","0.3","0.9","0.2","-0.1","-17.7","937","4"
"Grinding, lapping, polishing, and buffing machine tool setters, operators, and tenders, metal and plastic","=""51-4033""","Line Item","0.1","0.4","0.2","0.1","0.3","0.2","0.0","-17.7","939","4"
"Lathe and turning machine tool setters, operators, and tenders, metal and plastic","=""51-4034""","Line Item","0.1","0.3","0.5","0.1","0.2","0.5","0.0","-17.7","940","4"
"Machinists","=""51-4041""","Line Item","0.4","1.1","0.1","0.4","1.1","0.1","0.0","-8.6","942","3"
"Molders and molding machine setters, operators, and tenders, metal and plastic","=""51-4070""","Summary","0.1","0.2","0.0","0.1","0.2","0.0","0.0","-13.9","949","3"
"Molding, coremaking, and casting machine setters, operators, and tenders, metal and plastic","=""51-4072""","Line Item","0.1","0.2","0.0","0.1","0.2","0.0","0.0","-13.1","951","4"
"Multiple machine tool setters, operators, and tenders, metal and plastic","=""51-4081""","Line Item","0.2","0.5","0.1","0.2","0.5","0.1","0.0","-8.6","952","3"
"Welding, soldering, and brazing workers","=""51-4120""","Summary","1.0","2.5","0.2","0.9","2.6","0.2","-0.1","-8.9","954","3"
"Welders, cutters, solderers, and brazers","=""51-4121""","Line Item","1.0","2.4","0.2","0.9","2.5","0.2","-0.1","-8.6","955","4"
"Other production occupations","=""51-9000""","Summary","2.2","5.6","0.1","1.9","5.5","0.1","-0.3","-13.0","1009","2"
"Crushing, grinding, polishing, mixing, and blending workers","=""51-9020""","Summary","0.1","0.1","0.0","0.0","0.1","0.0","0.0","-17.8","1013","3"
"Extruding, forming, pressing, and compacting machine setters, operators, and tenders","=""51-9041""","Line Item","0.1","0.2","0.1","0.1","0.2","0.1","0.0","-8.6","1020","3"
"Inspectors, testers, sorters, samplers, and weighers","=""51-9061""","Line Item","0.5","1.2","0.1","0.4","1.1","0.1","-0.1","-22.3","1022","3"
"Packaging and filling machine operators and tenders","=""51-9111""","Line Item","0.1","0.4","0.0","0.1","0.4","0.0","0.0","-8.6","1028","3"
"Painting workers","=""51-9120""","Summary","0.8","2.0","0.4","0.7","2.0","0.4","-0.1","-8.6","1029","3"
"Coating, painting, and spraying machine setters, operators, and tenders","=""51-9124""","Line Item","0.7","1.9","0.4","0.7","1.9","0.4","-0.1","-8.6","1031","4"
"Computer numerically controlled tool operators and programmers","=""51-9160""","Summary","0.3","0.7","0.1","0.2","0.7","0.1","0.0","-15.0","1034","3"
"Computer numerically controlled tool operators","=""51-9161""","Line Item","0.2","0.6","0.1","0.2","0.6","0.1","0.0","-17.7","1035","4"
"Miscellaneous production workers","=""51-9190""","Summary","0.4","1.0","0.1","0.3","1.0","0.1","0.0","-11.2","1037","3"
"Molders, shapers, and casters, except metal and plastic","=""51-9195""","Line Item","0.2","0.4","0.4","0.2","0.5","0.4","0.0","-8.6","1042","4"
"Helpers--production workers","=""51-9198""","Line Item","0.1","0.3","0.1","0.1","0.3","0.1","0.0","-17.7","1045","4"
"Production workers, all other","=""51-9199""","Line Item","0.1","0.2","0.0","0.1","0.2","0.0","0.0","-8.6","1046","4"
"Transportation and material moving occupations","=""53-0000""","Summary","2.5","6.2","0.0","2.3","6.4","0.0","-0.2","-8.6","1047","1"
"Supervisors of transportation and material moving workers","=""53-1000""","Summary","0.1","0.4","0.0","0.1","0.4","0.0","0.0","-8.6","1048","2"
"First-line supervisors of transportation and material moving workers, except aircraft cargo handling supervisors","=""53-1047""","Line Item","0.1","0.4","0.0","0.1","0.4","0.0","0.0","-8.6","1050","3"
"Motor vehicle operators","=""53-3000""","Summary","0.1","0.4","0.0","0.1","0.4","0.0","0.0","-8.6","1059","2"
"Driver/sales workers and truck drivers","=""53-3030""","Summary","0.1","0.4","0.0","0.1","0.4","0.0","0.0","-8.6","1061","3"
"Heavy and tractor-trailer truck drivers","=""53-3032""","Line Item","0.1","0.1","0.0","0.1","0.1","0.0","0.0","-8.6","1063","4"
"Light truck drivers","=""53-3033""","Line Item","0.1","0.2","0.0","0.1","0.2","0.0","0.0","-8.6","1064","4"
"Material moving workers","=""53-7000""","Summary","2.2","5.5","0.0","2.0","5.6","0.0","-0.2","-8.6","1095","2"
"Industrial truck and tractor operators","=""53-7051""","Line Item","0.1","0.2","0.0","0.1","0.2","0.0","0.0","-8.6","1100","3"
"Laborers and freight, stock, and material movers, hand","=""53-7062""","Line Item","1.1","2.8","0.0","1.0","2.9","0.0","-0.1","-8.6","1103","4"
"Packers and packagers, hand","=""53-7064""","Line Item","0.2","0.5","0.0","0.2","0.5","0.0","0.0","-8.6","1105","4"
"Stockers and order fillers","=""53-7065""","Line Item","0.7","1.9","0.0","0.7","1.9","0.0","-0.1","-8.6","1106","4"
