"Occupation Title","Occupation Code","Occupation Type","2022 Employment","2022 Percent of Industry","2022 Percent of Occupation","Projected 2032 Employment","Projected 2032 Percent of Industry","Projected 2032 Percent of Occupation","Employment Change, 2022-2032","Employment Percent Change, 2022-2032","Occupation Sort","Display Level"
"Inspectors, testers, sorters, samplers, and weighers","=""51-9061""","Line Item","0.4","0.2","0.1","0.4","0.2","0.1","0.0","-5.0","1022","3"
"Painting workers","=""51-9120""","Summary","0.1","0.0","0.0","0.1","0.0","0.0","0.0","11.8","1029","3"
"Coating, painting, and spraying machine setters, operators, and tenders","=""51-9124""","Line Item","0.1","0.0","0.0","0.1","0.0","0.0","0.0","11.8","1031","4"
"Miscellaneous production workers","=""51-9190""","Summary","0.7","0.4","0.1","0.8","0.4","0.1","0.0","6.9","1037","3"
"Helpers--production workers","=""51-9198""","Line Item","0.3","0.2","0.2","0.3","0.2","0.2","0.0","0.6","1045","4"
"Production workers, all other","=""51-9199""","Line Item","0.3","0.2","0.1","0.4","0.2","0.1","0.0","11.8","1046","4"
"Transportation and material moving occupations","=""53-0000""","Summary","32.3","18.9","0.2","36.1","19.5","0.2","3.8","11.8","1047","1"
"Supervisors of transportation and material moving workers","=""53-1000""","Summary","2.2","1.3","0.4","2.5","1.3","0.4","0.3","11.8","1048","2"
"First-line supervisors of transportation and material moving workers, except aircraft cargo handling supervisors","=""53-1047""","Line Item","2.2","1.3","0.4","2.5","1.3","0.4","0.3","11.8","1050","3"
"Motor vehicle operators","=""53-3000""","Summary","12.6","7.4","0.3","14.1","7.6","0.3","1.5","11.8","1059","2"
"Driver/sales workers and truck drivers","=""53-3030""","Summary","12.5","7.3","0.3","14.0","7.6","0.3","1.5","11.8","1061","3"
"Driver/sales workers","=""53-3031""","Line Item","0.1","0.0","0.0","0.1","0.0","0.0","0.0","11.8","1062","4"
"Heavy and tractor-trailer truck drivers","=""53-3032""","Line Item","10.9","6.4","0.5","12.2","6.6","0.5","1.3","11.8","1063","4"
"Light truck drivers","=""53-3033""","Line Item","1.6","0.9","0.1","1.7","0.9","0.1","0.2","11.8","1064","4"
"Motor vehicle operators, all other","=""53-3099""","Line Item","0.1","0.1","0.2","0.1","0.1","0.2","0.0","11.8","1070","3"
"Water transportation workers","=""53-5000""","Summary","0.2","0.1","0.3","0.2","0.1","0.3","0.0","11.8","1079","2"
"Sailors and marine oilers","=""53-5011""","Line Item","0.1","0.0","0.2","0.1","0.0","0.3","0.0","11.8","1080","3"
"Ship and boat captains and operators","=""53-5020""","Summary","0.1","0.1","0.3","0.1","0.1","0.3","0.0","11.8","1081","3"
"Material moving workers","=""53-7000""","Summary","17.3","10.1","0.2","19.3","10.4","0.2","2.0","11.8","1095","2"
"Crane and tower operators","=""53-7021""","Line Item","0.1","0.0","0.1","0.1","0.0","0.1","0.0","11.8","1097","3"
"Industrial truck and tractor operators","=""53-7051""","Line Item","1.4","0.8","0.2","1.5","0.8","0.2","0.2","11.8","1100","3"
"Laborers and material movers","=""53-7060""","Summary","11.6","6.8","0.2","13.0","7.0","0.2","1.4","11.8","1101","3"
"Cleaners of vehicles and equipment","=""53-7061""","Line Item","1.2","0.7","0.3","1.3","0.7","0.3","0.1","11.8","1102","4"
"Laborers and freight, stock, and material movers, hand","=""53-7062""","Line Item","9.9","5.8","0.3","11.1","6.0","0.4","1.2","11.8","1103","4"
"Machine feeders and offbearers","=""53-7063""","Line Item","0.1","0.1","0.3","0.1","0.1","0.3","0.0","11.8","1104","4"
"Stockers and order fillers","=""53-7065""","Line Item","0.4","0.2","0.0","0.4","0.2","0.0","0.0","11.8","1106","4"
"Pumping station operators","=""53-7070""","Summary","0.8","0.4","2.4","0.9","0.5","2.7","0.1","11.8","1107","3"
"Pump operators, except wellhead pumpers","=""53-7072""","Line Item","0.8","0.4","6.8","0.8","0.5","7.3","0.1","11.8","1109","4"
"Refuse and recyclable material collectors","=""53-7081""","Line Item","3.3","1.9","2.3","3.7","2.0","2.5","0.4","11.8","1111","3"
"Material moving workers, all other","=""53-7199""","Line Item","0.1","0.1","0.5","0.1","0.1","0.5","0.0","11.8","1113","3"
