"Occupation Title","Occupation Code","Occupation Type","2022 Employment","2022 Percent of Industry","2022 Percent of Occupation","Projected 2032 Employment","Projected 2032 Percent of Industry","Projected 2032 Percent of Occupation","Employment Change, 2022-2032","Employment Percent Change, 2022-2032","Occupation Sort","Display Level"
"Transportation and material moving occupations","=""53-0000""","Summary","32.6","18.2","0.2","32.6","18.2","0.2","-0.1","-0.2","1047","1"
"Supervisors of transportation and material moving workers","=""53-1000""","Summary","1.5","0.9","0.3","1.5","0.9","0.2","0.0","-0.2","1048","2"
"First-line supervisors of transportation and material moving workers, except aircraft cargo handling supervisors","=""53-1047""","Line Item","1.5","0.9","0.3","1.5","0.9","0.2","0.0","-0.2","1050","3"
"Motor vehicle operators","=""53-3000""","Summary","2.2","1.2","0.0","2.2","1.2","0.0","0.0","-0.2","1059","2"
"Driver/sales workers and truck drivers","=""53-3030""","Summary","2.0","1.1","0.1","2.0","1.1","0.0","0.0","-0.2","1061","3"
"Driver/sales workers","=""53-3031""","Line Item","0.2","0.1","0.0","0.2","0.1","0.0","0.0","-0.2","1062","4"
"Heavy and tractor-trailer truck drivers","=""53-3032""","Line Item","1.2","0.7","0.1","1.2","0.7","0.1","0.0","-0.2","1063","4"
"Light truck drivers","=""53-3033""","Line Item","0.6","0.3","0.1","0.6","0.3","0.0","0.0","-0.2","1064","4"
"Material moving workers","=""53-7000""","Summary","28.9","16.2","0.4","28.9","16.1","0.3","-0.1","-0.2","1095","2"
"Conveyor operators and tenders","=""53-7011""","Line Item","0.4","0.2","1.4","0.4","0.2","1.4","0.0","-0.2","1096","3"
"Industrial truck and tractor operators","=""53-7051""","Line Item","8.5","4.8","1.1","8.5","4.7","1.0","0.0","-0.2","1100","3"
"Laborers and material movers","=""53-7060""","Summary","19.9","11.1","0.3","19.8","11.1","0.3","0.0","-0.2","1101","3"
"Cleaners of vehicles and equipment","=""53-7061""","Line Item","4.1","2.3","1.0","4.1","2.3","1.0","0.0","-0.2","1102","4"
"Laborers and freight, stock, and material movers, hand","=""53-7062""","Line Item","9.4","5.2","0.3","9.4","5.2","0.3","0.0","-0.2","1103","4"
"Machine feeders and offbearers","=""53-7063""","Line Item","0.3","0.1","0.5","0.3","0.1","0.5","0.0","-0.2","1104","4"
"Packers and packagers, hand","=""53-7064""","Line Item","4.7","2.6","0.7","4.7","2.6","0.7","0.0","-0.2","1105","4"
"Stockers and order fillers","=""53-7065""","Line Item","1.4","0.8","0.0","1.4","0.8","0.0","0.0","-0.2","1106","4"
"Material moving workers, all other","=""53-7199""","Line Item","0.1","0.0","0.3","0.1","0.0","0.2","0.0","-0.2","1113","3"
